{
  "$schema": "./_schema.json",
  "id": "hungry_ghost",
  "display_name_key": "GUEST_HUNGRY_GHOST_NAME",
  "description_key": "GUEST_HUNGRY_GHOST_DESC",
  "rarity": "common",
  "icon_path": "res://assets/sprites/guests/hungry_ghost_icon.png",
  "sprite_sheet": "res://assets/sprites/guests/hungry_ghost.png",

  "is_core_guest": true,

  "base_stats": {
	"needs": {
	  "food": 3
	},
	"money": 3,
	"movement_speed": 1
  },

  "skills": [],

  "animations": {
	"idle": { "frames": [0, 1, 2, 3], "fps": 8, "loop": true },
	"walk": { "frames": [4, 5, 6, 7], "fps": 12, "loop": true },
	"eat": { "frames": [8, 9, 10, 11], "fps": 10, "loop": false },
	"happy": { "frames": [12, 13, 14, 15], "fps": 8, "loop": false },
	"sad": { "frames": [16, 17, 18, 19], "fps": 6, "loop": false }
  },

  "tags": []
}
