{
  "$schema": "./_schema.json",
  "id": "seamstress",
  "display_name_key": "GUEST_SEAMSTRESS_NAME",
  "description_key": "GUEST_SEAMSTRESS_DESC",
  "rarity": "rare",
  "tier": 4,
  "is_core_guest": true,
  "base_stats": {
    "needs": {
      "food": 3,
      "joy": 3
    },
    "money": 3,
    "movement_speed": 1
  },
  "skills": [
    {
      "skill_id": "perfectionist"
    }
  ],
  "tags": []
}
