{
  "$schema": "./_schema.json",
  "id": "cat",
  "display_name_key": "GUEST_CAT_NAME",
  "description_key": "GUEST_CAT_DESC",
  "rarity": "common",
  "tier": 0,
  "icon_path": "res://assets/sprites/guests/cat_icon.png",
  "sprite_sheet": "res://assets/sprites/guests/cat.png",
  "is_core_guest": false,
  "base_stats": {
    "needs": {
      "food": 1
    },
    "money": 0,
    "movement_speed": 1
  },
  "skills": [
    {
      "skill_id": "cat_ascend_aoe_joy"
    }
  ],
  "animations": {
    "idle": {
      "frames": [
        0,
        1,
        2,
        3
      ],
      "fps": 8,
      "loop": true
    },
    "walk": {
      "frames": [
        4,
        5,
        6,
        7
      ],
      "fps": 12,
      "loop": true
    },
    "happy": {
      "frames": [
        8,
        9,
        10,
        11
      ],
      "fps": 8,
      "loop": false
    },
    "sad": {
      "frames": [
        12,
        13,
        14,
        15
      ],
      "fps": 6,
      "loop": false
    }
  },
  "tags": []
}
