{
  "$schema": "./_schema.json",
  "id": "qilin",
  "display_name_key": "GUEST_QILIN_NAME",
  "description_key": "GUEST_QILIN_DESC",
  "rarity": "rare",
  "tier": 0,
  "is_core_guest": false,
  "is_mythical_beast": true,
  "spawn_at_exit": true,
  "move_direction": "reverse",
  "base_stats": {
    "needs": {
      "interact": 3
    },
    "money": 0,
    "movement_speed": 1
  },
  "skills": [
    {
      "skill_id": "encounter_give_money",
      "parameters": {
        "amount": 3
      }
    },
    {
      "skill_id": "encounter_apply_status",
      "parameters": {
        "status_id": "gilded_burden",
        "stacks": 1
      }
    }
  ],
  "tags": [
    "beast"
  ]
}
