{
  "$schema": "./_schema.json",
  "id": "playful_spirit",
  "display_name_key": "GUEST_PLAYFUL_SPIRIT_NAME",
  "description_key": "GUEST_PLAYFUL_SPIRIT_DESC",
  "rarity": "common",
  "tier": 1,
  "icon_path": "res://assets/sprites/guests/playful_spirit_icon.png",
  "sprite_sheet": "res://assets/sprites/guests/playful_spirit.png",
  "is_core_guest": true,
  "base_stats": {
    "needs": {
      "joy": 3
    },
    "money": 3,
    "movement_speed": 1
  },
  "skills": [],
  "animations": {
    "idle": {
      "frames": [
        0,
        1,
        2,
        3
      ],
      "fps": 10,
      "loop": true
    },
    "walk": {
      "frames": [
        4,
        5,
        6,
        7
      ],
      "fps": 14,
      "loop": true
    },
    "play": {
      "frames": [
        8,
        9,
        10,
        11
      ],
      "fps": 12,
      "loop": false
    },
    "happy": {
      "frames": [
        12,
        13,
        14,
        15
      ],
      "fps": 10,
      "loop": false
    },
    "sad": {
      "frames": [
        16,
        17,
        18,
        19
      ],
      "fps": 8,
      "loop": false
    }
  },
  "tags": []
}
