{
  "$schema": "./_schema.json",
  "id": "nine_tailed_fox",
  "display_name_key": "GUEST_NINE_TAILED_FOX_NAME",
  "description_key": "GUEST_NINE_TAILED_FOX_DESC",
  "rarity": "rare",
  "tier": 0,
  "is_core_guest": false,
  "is_mythical_beast": true,
  "spawn_at_exit": true,
  "move_direction": "reverse",
  "base_stats": {
    "needs": {
      "interact": 3
    },
    "money": 0,
    "movement_speed": 1
  },
  "skills": [
    {
      "skill_id": "encounter_fulfill_need",
      "parameters": {
        "need_type": "joy",
        "amount": 2
      }
    },
    {
      "skill_id": "apply_status_on_interact",
      "parameters": {
        "status_id": "charmed",
        "stacks": 8
      }
    }
  ],
  "tags": [
    "beast"
  ]
}
