{
  "$schema": "./_schema.json",
  "id": "wandering_shade",
  "display_name_key": "GUEST_WANDERING_SHADE_NAME",
  "description_key": "GUEST_WANDERING_SHADE_DESC",
  "rarity": "common",
  "tier": 1,
  "icon_path": "res://assets/sprites/guests/wandering_shade_icon.png",
  "sprite_sheet": "res://assets/sprites/guests/wandering_shade.png",
  "is_core_guest": true,
  "base_stats": {
    "needs": {
      "food": 2,
      "joy": 2
    },
    "money": 5,
    "movement_speed": 1
  },
  "skills": [],
  "animations": {
    "idle": {
      "frames": [
        0,
        1,
        2,
        3
      ],
      "fps": 6,
      "loop": true
    },
    "walk": {
      "frames": [
        4,
        5,
        6,
        7
      ],
      "fps": 10,
      "loop": true
    },
    "eat": {
      "frames": [
        8,
        9,
        10,
        11
      ],
      "fps": 8,
      "loop": false
    },
    "play": {
      "frames": [
        12,
        13,
        14,
        15
      ],
      "fps": 8,
      "loop": false
    },
    "happy": {
      "frames": [
        16,
        17,
        18,
        19
      ],
      "fps": 8,
      "loop": false
    },
    "sad": {
      "frames": [
        20,
        21,
        22,
        23
      ],
      "fps": 6,
      "loop": false
    }
  },
  "tags": []
}
